{
    "challenge_problem": "YG",
    "experiment_id": "exp_id",
    "experiment_reference": "https://docs.google.com/document/d/14wB9eJL3p3oDBkPR6Tzowh_YGyGJ0XAL2vw5-zNwuw0/edit?usp=sharing",
    "lab": "TX",
    "samples": [
        {
            "contents": [
                "rs1b4uj7zbdy6m"
            ],
            "experimental_media": "rs1b4uj7zbdy6m",
            "files": [
                {
                    "name": "s3://sd2e-community/uploads/transcriptic/201808/yeast-gates/r1bsmggea748b_r1bsun4yb67e7/od1.csv",
                    "sha256": "a0b7d4c4f5f60c498545bbcb08edcfcf4510aa6b324c1d28431742713d68ecbb",
                    "type": "PLATE_READER"
                }
            ],
            "replicate": "1",
            "sample_id": "7373",
            "strain": "7373",
            "temperature": "30:celsius",
            "timepoint": "16:hour",
            "tx_sample_id": "aq1bsuhh8sb9pv/ct1bsmggegqg89"
        },
        {
            "contents": [
                "rs1b4uj7zbdy6m"
            ],
            "experimental_media": "rs1b4uj7zbdy6m",
            "files": [
                {
                    "name": "s3://sd2e-community/uploads/transcriptic/201808/yeast-gates/r1bsmggea748b_r1bsun4yb67e7/od1.csv",
                    "sha256": "a0b7d4c4f5f60c498545bbcb08edcfcf4510aa6b324c1d28431742713d68ecbb",
                    "type": "PLATE_READER"
                }
            ],
            "replicate": "2",
            "sample_id": "7373",
            "strain": "7373",
            "temperature": "30:celsius",
            "timepoint": "16:hour",
            "tx_sample_id": "aq1bsuhh8sb9px/ct1bsmggegqg89"
        },
        {
            "contents": [
                "rs1b4uj7zbdy6m"
            ],
            "experimental_media": "rs1b4uj7zbdy6m",
            "files": [
                {
                    "name": "s3://sd2e-community/uploads/transcriptic/201808/yeast-gates/r1bsmggea748b_r1bsun4yb67e7/od1.csv",
                    "sha256": "a0b7d4c4f5f60c498545bbcb08edcfcf4510aa6b324c1d28431742713d68ecbb",
                    "type": "PLATE_READER"
                }
            ],
            "replicate": "3",
            "sample_id": "7373",
            "strain": "7373",
            "temperature": "30:celsius",
            "timepoint": "16:hour",
            "tx_sample_id": "aq1bsuhh8sccsw/ct1bsmggegqg89"
        },
        {
            "contents": [
                "rs1b4uj7zbdy6m"
            ],
            "experimental_media": "rs1b4uj7zbdy6m",
            "files": [
                {
                    "name": "s3://sd2e-community/uploads/transcriptic/201808/yeast-gates/r1bsmggea748b_r1bsun4yb67e7/od1.csv",
                    "sha256": "a0b7d4c4f5f60c498545bbcb08edcfcf4510aa6b324c1d28431742713d68ecbb",
                    "type": "PLATE_READER"
                }
            ],
            "replicate": "4",
            "sample_id": "7373",
            "strain": "7373",
            "temperature": "30:celsius",
            "timepoint": "16:hour",
            "tx_sample_id": "aq1bsuhh8sdfvx/ct1bsmggegqg89"
        },
        {
            "contents": [
                "rs1b4uj7zbdy6m"
            ],
            "experimental_media": "rs1b4uj7zbdy6m",
            "files": [
                {
                    "name": "s3://sd2e-community/uploads/transcriptic/201808/yeast-gates/r1bsmggea748b_r1bsun4yb67e7/od1.csv",
                    "sha256": "a0b7d4c4f5f60c498545bbcb08edcfcf4510aa6b324c1d28431742713d68ecbb",
                    "type": "PLATE_READER"
                }
            ],
            "replicate": "5",
            "sample_id": "7373",
            "strain": "7373",
            "temperature": "30:celsius",
            "timepoint": "16:hour",
            "tx_sample_id": "aq1bsuhh8sdfvz/ct1bsmggegqg89"
        },
        {
            "contents": [
                "rs1b4uj7zbdy6m"
            ],
            "experimental_media": "rs1b4uj7zbdy6m",
            "files": [
                {
                    "name": "s3://sd2e-community/uploads/transcriptic/201808/yeast-gates/r1bsmggea748b_r1bsun4yb67e7/od1.csv",
                    "sha256": "a0b7d4c4f5f60c498545bbcb08edcfcf4510aa6b324c1d28431742713d68ecbb",
                    "type": "PLATE_READER"
                }
            ],
            "replicate": "1",
            "sample_id": "7374",
            "strain": "7374",
            "temperature": "30:celsius",
            "timepoint": "16:hour",
            "tx_sample_id": "aq1bsuhh8sfp3z/ct1bsmggegqg89"
        },
        {
            "contents": [
                "rs1b4uj7zbdy6m"
            ],
            "experimental_media": "rs1b4uj7zbdy6m",
            "files": [
                {
                    "name": "s3://sd2e-community/uploads/transcriptic/201808/yeast-gates/r1bsmggea748b_r1bsun4yb67e7/od1.csv",
                    "sha256": "a0b7d4c4f5f60c498545bbcb08edcfcf4510aa6b324c1d28431742713d68ecbb",
                    "type": "PLATE_READER"
                }
            ],
            "replicate": "2",
            "sample_id": "7374",
            "strain": "7374",
            "temperature": "30:celsius",
            "timepoint": "16:hour",
            "tx_sample_id": "aq1bsuhh8sfp43/ct1bsmggegqg89"
        },
        {
            "contents": [
                "rs1b4uj7zbdy6m"
            ],
            "experimental_media": "rs1b4uj7zbdy6m",
            "files": [
                {
                    "name": "s3://sd2e-community/uploads/transcriptic/201808/yeast-gates/r1bsmggea748b_r1bsun4yb67e7/od1.csv",
                    "sha256": "a0b7d4c4f5f60c498545bbcb08edcfcf4510aa6b324c1d28431742713d68ecbb",
                    "type": "PLATE_READER"
                }
            ],
            "replicate": "3",
            "sample_id": "7374",
            "strain": "7374",
            "temperature": "30:celsius",
            "timepoint": "16:hour",
            "tx_sample_id": "aq1bsuhh8sgs72/ct1bsmggegqg89"
        },
        {
            "contents": [
                "rs1b4uj7zbdy6m"
            ],
            "experimental_media": "rs1b4uj7zbdy6m",
            "files": [
                {
                    "name": "s3://sd2e-community/uploads/transcriptic/201808/yeast-gates/r1bsmggea748b_r1bsun4yb67e7/od1.csv",
                    "sha256": "a0b7d4c4f5f60c498545bbcb08edcfcf4510aa6b324c1d28431742713d68ecbb",
                    "type": "PLATE_READER"
                }
            ],
            "replicate": "4",
            "sample_id": "7374",
            "strain": "7374",
            "temperature": "30:celsius",
            "timepoint": "16:hour",
            "tx_sample_id": "aq1bsuhh8shva3/ct1bsmggegqg89"
        },
        {
            "contents": [
                "rs1b4uj7zbdy6m"
            ],
            "experimental_media": "rs1b4uj7zbdy6m",
            "files": [
                {
                    "name": "s3://sd2e-community/uploads/transcriptic/201808/yeast-gates/r1bsmggea748b_r1bsun4yb67e7/od1.csv",
                    "sha256": "a0b7d4c4f5f60c498545bbcb08edcfcf4510aa6b324c1d28431742713d68ecbb",
                    "type": "PLATE_READER"
                }
            ],
            "replicate": "1",
            "sample_id": "wt-control-1",
            "strain": "W303dip1",
            "temperature": "30:celsius",
            "timepoint": "16:hour",
            "tx_sample_id": "aq1bsuhh8ruyef/ct1bsmggegqg89"
        },
        {
            "contents": [
                "rs1b4uj7zbdy6m"
            ],
            "experimental_media": "rs1b4uj7zbdy6m",
            "files": [
                {
                    "name": "s3://sd2e-community/uploads/transcriptic/201808/yeast-gates/r1bsmggea748b_r1bsun4yb67e7/od1.csv",
                    "sha256": "a0b7d4c4f5f60c498545bbcb08edcfcf4510aa6b324c1d28431742713d68ecbb",
                    "type": "PLATE_READER"
                }
            ],
            "replicate": "3",
            "sample_id": "7376",
            "strain": "7376",
            "temperature": "30:celsius",
            "timepoint": "16:hour",
            "tx_sample_id": "aq1bsuhh8s3jzn/ct1bsmggegqg89"
        },
        {
            "contents": [
                "rs1b4uj7zbdy6m"
            ],
            "experimental_media": "rs1b4uj7zbdy6m",
            "files": [
                {
                    "name": "s3://sd2e-community/uploads/transcriptic/201808/yeast-gates/r1bsmggea748b_r1bsun4yb67e7/od1.csv",
                    "sha256": "a0b7d4c4f5f60c498545bbcb08edcfcf4510aa6b324c1d28431742713d68ecbb",
                    "type": "PLATE_READER"
                }
            ],
            "replicate": "5",
            "sample_id": "7375",
            "strain": "7375",
            "temperature": "30:celsius",
            "timepoint": "16:hour",
            "tx_sample_id": "aq1bsuhh8s93gv/ct1bsmggegqg89"
        },
        {
            "contents": [
                "rs1b4uj7zbdy6m"
            ],
            "experimental_media": "rs1b4uj7zbdy6m",
            "files": [
                {
                    "name": "s3://sd2e-community/uploads/transcriptic/201808/yeast-gates/r1bsmggea748b_r1bsun4yb67e7/od1.csv",
                    "sha256": "a0b7d4c4f5f60c498545bbcb08edcfcf4510aa6b324c1d28431742713d68ecbb",
                    "type": "PLATE_READER"
                }
            ],
            "replicate": "2",
            "sample_id": "wt-control-1",
            "strain": "W303dip1",
            "temperature": "30:celsius",
            "timepoint": "16:hour",
            "tx_sample_id": "aq1bsuhh8rw3hh/ct1bsmggegqg89"
        },
        {
            "contents": [
                "rs1b4uj7zbdy6m"
            ],
            "experimental_media": "rs1b4uj7zbdy6m",
            "files": [
                {
                    "name": "s3://sd2e-community/uploads/transcriptic/201808/yeast-gates/r1bsmggea748b_r1bsun4yb67e7/od1.csv",
                    "sha256": "a0b7d4c4f5f60c498545bbcb08edcfcf4510aa6b324c1d28431742713d68ecbb",